blended_score,business_type,company_name,differentiation_indicator,evidence,evidence_urls,fit_confidence,homepage_used,is_construction_or_installation,is_fit_for_nivo,is_generic_distributor,is_hospitality_or_property_company,is_service_heavy,is_subsidiary_or_group_company,niche_indicator,operating_model,orgnr,pages_fetched_count,reason_summary,red_flags,repeat_purchase_indicator,scalable_business_indicator,stage1_total_score,tavily_used
37.8,service_company,Skanska AB,low,Homepage: focuses on project development and construction services|About: mentions various construction projects and services offered,https://www.skanska.se|https://www.skanska.se/vart-erbjudande/vara-projekt/,0.2,https://www.skanska.se,True,False,False,False,True,True,low,installer,5560001438,2,"The evidence indicates that Skanska is primarily a construction and installation company, which does not align with Nivo's focus on product-led businesses. The content is heavily focused on project development and construction services, lacking identifiable products or brands.",parent/group branding|appears to be installation-only,low,low,90.0,False
35.8,service_company,NCC AB,low,Homepage: focuses on construction and infrastructure projects|About: operates as a construction company with various large-scale projects|Products: no identifiable products or brands mentioned,https://www.ncc.se|https://www.ncc.se/media/nyheter/ncc-tecknar-hyresavtal-med-academic-work-i-habitat-goteborg/|https://www.ncc.se/vart-erbjudande/,0.2,https://www.ncc.se,True,False,False,False,True,True,low,installer,5560067517,3,"The company primarily operates in the construction sector, focusing on building infrastructure and facilities, which does not align with Nivo's investment criteria. There is a lack of identifiable products or brands, and the business model appears heavily service-oriented with a focus on installation and construction.",parent/group branding|service-heavy model,low,low,85.0,False
33.8,service_company,Peab AB,low,Homepage: focuses on construction and installation services|About: mentions being a local company with large resources|Products: offers various construction-related services and materials,https://peab.se/|https://peab.se/erbjudande/,0.2,https://peab.se,True,False,False,False,True,True,low,installer,5560347328,2,"The company primarily operates in construction and installation services, which does not align with Nivo's focus on product-led businesses. The evidence suggests a service-heavy model with limited differentiation and no identifiable products or repeat purchase indicators.",clear installation and construction focus|parent/group branding,low,low,80.0,False
29.8,service_company,McDonald's Sverige AB,low,Homepage: offers various food items and delivery services|About: McDonald's is a global brand with a significant presence in Sweden|Homepage: mentions sustainability initiatives and customer engagement through an app,https://www.mcdonalds.com/se/sv-se.html|https://www.mcdonalds.com/se/sv-se/om-oss.html|https://www.mcdonalds.com/se/sv-se/kundservice.html,0.2,https://www.mcdonalds.com/se/sv-se.html,False,False,False,True,True,True,low,unknown,5562404566,3,"The company operates as a restaurant chain, which is typically classified as hospitality rather than a product-led business. The evidence primarily describes services and offerings rather than identifiable products or a differentiated business model.",Parent/group branding present|Primarily service-oriented business model,high,medium,70.0,False
34.6,service_company,ISS Facility Services AB,low,"TAVILY_SNIPPET: offers services such as food and drinks, cleaning, facility management, office, and property services|TAVILY_SNIPPET: established in 1990 as a subsidiary",https://largestcompanies.com/company/ISS-Facility-Services-AB-2636|https://www.bloomberg.com/profile/company/7277681Z:SS|https://rocketreach.co/iss-facility-services-sweden-profile_b5cdb6e0f42e0b75|https://largestcompanies.com/Account/Login?returnUrl=%2Fcompany%2FISS-Facility-Services-AB-2636|https://largestcompanies.com/our-services,0.2,https://largestcompanies.com/company/ISS-Facility-Services-AB-2636,False,False,False,False,True,True,low,unknown,5560178917,3,"The company primarily offers facility management and cleaning services, which are service-heavy and do not indicate a product-led model. It is a subsidiary of a larger group, further reducing its fit for Nivo.",Subsidiary company to ISS Facility Services Holding AB|Service-heavy business model with no identifiable products,low,low,82.0,True
29.0,service_company,Adecco Sweden AB,low,"Homepage: staffing and recruitment services|About: 30+ years in the industry, 200,000+ candidates",https://www.adecco.com/sv-se|https://www.adecco.com/sv-se/foretag|https://www.adecco.com/sv-se/jobbsokande/livsmedelsproduktion,0.2,https://www.adecco.com/sv-se,False,False,False,False,True,False,low,consultancy,5560993286,3,"The company primarily operates as a staffing and recruitment service, which is service-heavy and lacks identifiable products or a scalable business model. The evidence suggests a focus on consultancy rather than product-led differentiation.",Service-heavy business model with no identifiable products or brands,low,low,68.0,False
31.8,service_company,Coor Service Management AB,low,Homepage: facility management services|About: 40% market share in IFM segment|Services: over 100 service areas offered,https://www.coor.com|https://www.coor.com/about-us/|https://www.coor.com/our-services/,0.2,https://www.coor.com,False,False,False,True,True,True,low,unknown,5560885559,3,"Coor Service Management AB primarily operates in facility management, which is service-heavy and lacks identifiable product differentiation. The company appears to be a subsidiary within a larger group, focusing on integrated facility management services rather than product-led offerings. This limits its fit for Nivo's investment criteria.",Parent/group branding|Service-heavy business model,low,medium,75.0,False
27.8,service_company,Foodora AB,low,Homepage: food delivery service in Stockholm|Homepage: partnerships with various restaurants and cafes,https://www.foodora.se,0.2,https://www.foodora.se,False,False,False,True,True,False,low,unknown,5591155720,1,"The website primarily describes a food delivery service, which falls under hospitality rather than a product-led business model. There is no evidence of identifiable products or a differentiated offering that aligns with Nivo's investment criteria.",hospitality or property company,low,medium,65.0,False
30.6,service_company,Academic Work Sweden AB,low,Homepage: staffing and recruitment services|About: expertise in matching talents with employers|Products: flexible staffing solutions,https://www.academicwork.se|https://www.academicwork.se/foretag|https://www.academicwork.se/foretag/tjanster/bemanning,0.2,https://www.academicwork.se,False,False,False,False,True,False,low,consultancy,5565669668,3,"The company primarily operates as a staffing and recruitment agency, which is considered service-heavy and does not align with product-led business models. The evidence suggests a focus on consultancy rather than identifiable products or brands.",Service-heavy business model|Primarily a recruitment agency,low,medium,72.0,False
